{
  "$schema": "https://json-schema.org/draft/2020-12/schema",
  "$id": "naam-dialogue-record.schema.json",
  "title": "Naam immutable dialogue record",
  "type": "object",
  "required": [
    "id",
    "scene_id",
    "scene_ordinal",
    "source_scene_number",
    "source_heading",
    "speaker_label",
    "source_delimiter",
    "text",
    "page_provenance",
    "source_scene_file"
  ],
  "properties": {
    "id": {
      "type": "string",
      "pattern": "^naam-s[0-9]{3}-d[0-9]{3}$"
    },
    "scene_id": {
      "type": "string",
      "pattern": "^naam-s[0-9]{3}$"
    },
    "scene_ordinal": {
      "type": "integer",
      "minimum": 1,
      "maximum": 45
    },
    "source_scene_number": {
      "type": "integer",
      "minimum": 1,
      "maximum": 45
    },
    "source_heading": {
      "type": "string",
      "minLength": 1
    },
    "speaker_label": {
      "type": "string",
      "minLength": 1
    },
    "source_delimiter": {
      "type": "string",
      "enum": [
        ":",
        ":-",
        "—"
      ]
    },
    "text": {
      "type": "string",
      "minLength": 1
    },
    "page_provenance": {
      "type": "array",
      "minItems": 1,
      "uniqueItems": true,
      "items": {
        "type": "object",
        "required": [
          "pdf_page",
          "printed_page"
        ],
        "properties": {
          "pdf_page": {
            "type": "integer",
            "minimum": 5,
            "maximum": 71
          },
          "printed_page": {
            "type": [
              "integer",
              "null"
            ],
            "minimum": 6,
            "maximum": 71
          }
        },
        "additionalProperties": false
      }
    },
    "page_segments": {
      "type": "array",
      "minItems": 2,
      "items": {
        "type": "object",
        "required": [
          "pdf_page",
          "printed_page",
          "text"
        ],
        "properties": {
          "pdf_page": {
            "type": "integer",
            "minimum": 5,
            "maximum": 71
          },
          "printed_page": {
            "type": [
              "integer",
              "null"
            ],
            "minimum": 6,
            "maximum": 71
          },
          "text": {
            "type": "string",
            "minLength": 1
          }
        },
        "additionalProperties": false
      }
    },
    "source_scene_file": {
      "type": "string",
      "pattern": "^scene-[0-9]{3}\\.md$"
    }
  },
  "additionalProperties": false
}
