[
  {
    "id": "naam-s002-d001",
    "scene_id": "naam-s002",
    "scene_ordinal": 2,
    "source_scene_number": 2,
    "source_heading": "காட்சி 2",
    "speaker_label": "நாரா",
    "source_delimiter": ":-",
    "source_scene_file": "scene-002.md",
    "page_provenance": [
      {
        "pdf_page": 7,
        "printed_page": 7
      }
    ],
    "text": "குவிந்து கிடக்கும் செல்வத்தை ஒரு கொடியவன் அனுபவிக்க விட்டு விட்டு, நானும்—என் மகனும் கண் இருந்தும் குருடர்களாக அலைய வேண்டுமென்பது விதியா வைத்தியரே......?"
  },
  {
    "id": "naam-s002-d002",
    "scene_id": "naam-s002",
    "scene_ordinal": 2,
    "source_scene_number": 2,
    "source_heading": "காட்சி 2",
    "speaker_label": "சஞ்சீவி",
    "source_delimiter": ":-",
    "source_scene_file": "scene-002.md",
    "page_provenance": [
      {
        "pdf_page": 7,
        "printed_page": 7
      }
    ],
    "text": "வேதவல்லி......"
  },
  {
    "id": "naam-s002-d003",
    "scene_id": "naam-s002",
    "scene_ordinal": 2,
    "source_scene_number": 2,
    "source_heading": "காட்சி 2",
    "speaker_label": "நாரா",
    "source_delimiter": ":-",
    "source_scene_file": "scene-002.md",
    "page_provenance": [
      {
        "pdf_page": 7,
        "printed_page": 7
      }
    ],
    "text": "உஸ்......குமரனுக்குத் தெரியாது."
  },
  {
    "id": "naam-s002-d004",
    "scene_id": "naam-s002",
    "scene_ordinal": 2,
    "source_scene_number": 2,
    "source_heading": "காட்சி 2",
    "speaker_label": "சஞ்",
    "source_delimiter": ":-",
    "source_scene_file": "scene-002.md",
    "page_provenance": [
      {
        "pdf_page": 7,
        "printed_page": 7
      }
    ],
    "text": "ஹூம்...நாராயணி...இன்றைய ஜமீன்தார் மல்லயப்பனுக்கு உன்னைத் தெரியாது. நியாயம்...குமரனும் சில நாள் அங்கேயே வேலைக்கு அமரவேண்டும்."
  },
  {
    "id": "naam-s002-d005",
    "scene_id": "naam-s002",
    "scene_ordinal": 2,
    "source_scene_number": 2,
    "source_heading": "காட்சி 2",
    "speaker_label": "நாரா",
    "source_delimiter": ":-",
    "source_scene_file": "scene-002.md",
    "page_provenance": [
      {
        "pdf_page": 7,
        "printed_page": 7
      }
    ],
    "text": "வேலைக்கா?"
  },
  {
    "id": "naam-s002-d006",
    "scene_id": "naam-s002",
    "scene_ordinal": 2,
    "source_scene_number": 2,
    "source_heading": "காட்சி 2",
    "speaker_label": "சஞ்",
    "source_delimiter": ":-",
    "source_scene_file": "scene-002.md",
    "page_provenance": [
      {
        "pdf_page": 7,
        "printed_page": 7
      }
    ],
    "text": "அப்படியானால் தான் நமது இலட்சியம் நிறைவேறும்! மறைந்து கிடக்கும் உயிரையும் நீ அங்கேயே கண்டு பிடிக்கவும் கூடும்! குமரனுக்கும் ஜமீன் பழக்க வழக்கங்கள் பாடமாகும்!"
  },
  {
    "id": "naam-s002-d007",
    "scene_id": "naam-s002",
    "scene_ordinal": 2,
    "source_scene_number": 2,
    "source_heading": "காட்சி 2",
    "speaker_label": "நாரா",
    "source_delimiter": ":-",
    "source_scene_file": "scene-002.md",
    "page_provenance": [
      {
        "pdf_page": 8,
        "printed_page": 8
      }
    ],
    "text": "குமரனுக்கு பணக்கார வீடு என்றால் பிடிக்காது! அந்த ஊரிலே சீர்திருத்தம் பேசித்தான் உயிருக்கு ஆபத்து வந்து—இந்த ஊருக்கு வந்தோம்."
  },
  {
    "id": "naam-s002-d008",
    "scene_id": "naam-s002",
    "scene_ordinal": 2,
    "source_scene_number": 2,
    "source_heading": "காட்சி 2",
    "speaker_label": "சஞ்",
    "source_delimiter": ":-",
    "source_scene_file": "scene-002.md",
    "page_provenance": [
      {
        "pdf_page": 8,
        "printed_page": 8
      }
    ],
    "text": "இப்போது எல்லா சீர்திருத்தமும், கொள்கைகளும் பேசலாம்! பிறகு ஜமீன் கிடைத்து விட்டால் அந்த உல்லாசத்திலே அவற்றை எல்லாம் மறந்து விடுவான்! நாராயணி...நான் சொன்னது ஞாபகமிருக்கட்டும்!"
  },
  {
    "id": "naam-s002-d009",
    "scene_id": "naam-s002",
    "scene_ordinal": 2,
    "source_scene_number": 2,
    "source_heading": "காட்சி 2",
    "speaker_label": "நாராயணி",
    "source_delimiter": ":-",
    "source_scene_file": "scene-002.md",
    "page_provenance": [
      {
        "pdf_page": 8,
        "printed_page": 8
      }
    ],
    "text": "குமரா...குமரா...!"
  },
  {
    "id": "naam-s002-d010",
    "scene_id": "naam-s002",
    "scene_ordinal": 2,
    "source_scene_number": 2,
    "source_heading": "காட்சி 2",
    "speaker_label": "கும",
    "source_delimiter": ":-",
    "source_scene_file": "scene-002.md",
    "page_provenance": [
      {
        "pdf_page": 8,
        "printed_page": 8
      }
    ],
    "text": "என்னம்மா! ரகசியமெல்லாம் பேசி முடிந்ததா?"
  },
  {
    "id": "naam-s002-d011",
    "scene_id": "naam-s002",
    "scene_ordinal": 2,
    "source_scene_number": 2,
    "source_heading": "காட்சி 2",
    "speaker_label": "நாரா",
    "source_delimiter": ":-",
    "source_scene_file": "scene-002.md",
    "page_provenance": [
      {
        "pdf_page": 8,
        "printed_page": 8
      }
    ],
    "text": "குமரா! நமக்கு ஜமீன்தார் வீட்டிலே வேலை கிடைக்கப் போகுதாம்!"
  },
  {
    "id": "naam-s002-d012",
    "scene_id": "naam-s002",
    "scene_ordinal": 2,
    "source_scene_number": 2,
    "source_heading": "காட்சி 2",
    "speaker_label": "கும",
    "source_delimiter": ":-",
    "source_scene_file": "scene-002.md",
    "page_provenance": [
      {
        "pdf_page": 8,
        "printed_page": 8
      }
    ],
    "text": "வேலையா! ஜமீன்தார் வீட்டிலேயா?"
  },
  {
    "id": "naam-s002-d013",
    "scene_id": "naam-s002",
    "scene_ordinal": 2,
    "source_scene_number": 2,
    "source_heading": "காட்சி 2",
    "speaker_label": "நாரா",
    "source_delimiter": ":",
    "source_scene_file": "scene-002.md",
    "page_provenance": [
      {
        "pdf_page": 8,
        "printed_page": 8
      }
    ],
    "text": "சொல்றதை சரின்னு கேக்கணும்!"
  }
]
