[
  {
    "id": "naam-s021-d001",
    "scene_id": "naam-s021",
    "scene_ordinal": 21,
    "source_scene_number": 21,
    "source_heading": "காட்சி 21.",
    "speaker_label": "கும",
    "source_delimiter": ":-",
    "source_scene_file": "scene-021.md",
    "page_provenance": [
      {
        "pdf_page": 36,
        "printed_page": 36
      }
    ],
    "text": "மீனு..."
  },
  {
    "id": "naam-s021-d002",
    "scene_id": "naam-s021",
    "scene_ordinal": 21,
    "source_scene_number": 21,
    "source_heading": "காட்சி 21.",
    "speaker_label": "மீனு",
    "source_delimiter": ":-",
    "source_scene_file": "scene-021.md",
    "page_provenance": [
      {
        "pdf_page": 36,
        "printed_page": 36
      }
    ],
    "text": "குமரன்...... (அழாதே மீனு)..."
  },
  {
    "id": "naam-s021-d003",
    "scene_id": "naam-s021",
    "scene_ordinal": 21,
    "source_scene_number": 21,
    "source_heading": "காட்சி 21.",
    "speaker_label": "கும",
    "source_delimiter": ":-",
    "source_scene_file": "scene-021.md",
    "page_provenance": [
      {
        "pdf_page": 36,
        "printed_page": 36
      }
    ],
    "text": "என்னை மன்னித்து விடு மீனு! ஆமா...இந்த இருட்டில் நீ எப்படி தனியாக வருகிறாய்? வரலாமா இப்படி யெல்லாம்?"
  },
  {
    "id": "naam-s021-d004",
    "scene_id": "naam-s021",
    "scene_ordinal": 21,
    "source_scene_number": 21,
    "source_heading": "காட்சி 21.",
    "speaker_label": "மீனு",
    "source_delimiter": ":-",
    "source_scene_file": "scene-021.md",
    "page_provenance": [
      {
        "pdf_page": 36,
        "printed_page": 36
      }
    ],
    "text": "வரக் கூடாது தான்! ஆனால்...என் வாடிப் போன நெஞ்சிற்கு இது வரையிலும் என் மாமியின் சமாதி தானே ஆறுதலாக இருந்தது."
  },
  {
    "id": "naam-s021-d005",
    "scene_id": "naam-s021",
    "scene_ordinal": 21,
    "source_scene_number": 21,
    "source_heading": "காட்சி 21.",
    "speaker_label": "கும",
    "source_delimiter": ":-",
    "source_scene_file": "scene-021.md",
    "page_provenance": [
      {
        "pdf_page": 36,
        "printed_page": 36
      }
    ],
    "text": "உன் நெஞ்சு இன்னுமா வாடிப் போயிருக்கிறது?"
  },
  {
    "id": "naam-s021-d006",
    "scene_id": "naam-s021",
    "scene_ordinal": 21,
    "source_scene_number": 21,
    "source_heading": "காட்சி 21.",
    "speaker_label": "மீனு",
    "source_delimiter": ":-",
    "source_scene_file": "scene-021.md",
    "page_provenance": [
      {
        "pdf_page": 36,
        "printed_page": 36
      }
    ],
    "text": "அகத்தின் அழகு முகத்தில் தெரியுமே..."
  },
  {
    "id": "naam-s021-d007",
    "scene_id": "naam-s021",
    "scene_ordinal": 21,
    "source_scene_number": 21,
    "source_heading": "காட்சி 21.",
    "speaker_label": "கும",
    "source_delimiter": ":-",
    "source_scene_file": "scene-021.md",
    "page_provenance": [
      {
        "pdf_page": 36,
        "printed_page": 36
      }
    ],
    "text": "எங்கே...பார்க்கலாம்."
  }
]
